,Texto,Clasificacion,clean
308,Cuando dicen: ‘¿Por qué alcanza el dinero? ¿De dónde sale tanto dinero? ¿Por qué se hacen tantas cosas?’,economia,cuando decir por qué alcanzar el dinero de dónde salir tanto dinero por qué él hacer tanto cosa
309,"Porque no hay corrupción. Una sucursal de un Banco del Bienestar de cinco millones, pues no. En los tiempos de la corrupción del periodo neoporfirista, si lo hacían, lo cobraban en 30, en 50 millones, y no se concluía en tres meses; se entregaban los anticipos, se robaban el anticipo y ya ahí quedaba tirado.",seguridad,porque no haber corrupción uno sucursal de uno banco del bienestar de cinco millón pues no en el tiempo de el corrupción del periodo neoporfirista si él hacer él cobrar en 30 en 50 millón y no él concluir en tres mes él entregar el anticipo él robar el anticipo y ya ahí quedar tirado
310,"Entonces, esto es muy importante, entonces vamos a dar a conocer los municipios porque un municipio de la Huasteca hidalguense que tiene que ir a Huejutla, ¿cuánto es?, puede ser dos, tres, cuatro horas, a tener ahí la sucursal.",apoyo,entonces este ser mucho importante entonces ir a dar a conocer el municipio porque uno municipio de el huasteca hidalguense que tener que ir a huejutla cuánto ser poder ser dos tres cuatro hora a tener ahí el sucursal
311," Lo primero es que sigan denunciándolo. Yo no he escuchado, ¿eh?, que haya tráfico para las entrevistas.",seguridad,  él primero ser que seguir denunciando él yo no haber escuchar eh que haber tráfico para el entrevista
312,"Me acordé ahora de un funcionario del periodo neoliberal, corrupto, que cobraba por audiencia, pero bastante, para recibir le tenían que dar dinero. Claro que el que hablaba con él salía con algo, sí, se rayaba, un contrato, cualquier cosa. Pero nada más para la audiencia había que pagar para que lo recibieran. Esto parece increíble. Nada más lo repito para que no se olvide.",competencia,yo acordar ahora de uno funcionario del periodo neoliberal corrupto que cobrar por audiencia pero bastante para recibir él tener que dar dinero claro que el que hablar con él salir con algo sí él rayar uno contrato cualquiera cosa pero nada más para el audiencia haber que pagar para que él recibir este parecer increíble nada más él repetir para que no él olvidar
313,"Entonces, que los sigan denunciando. Yo no he escuchado esta denuncia. Y le tengo mucha confianza a Marcelo Ebrard y a todo su equipo, y constantemente están ellos haciendo evaluaciones con cónsules, con embajadores.",exterior,entonces que él seguir denunciar yo no haber escuchar este denuncia y él tener mucho confianza a marcelo ebrard y a todo su equipo y constantemente estar él hacer evaluación con cónsul con embajador
314,"Y, bueno, vamos a seguir mejorando el servicio y limpiando de corrupción todo el gobierno, y en este caso los consulados. Y se tiene que atender muy bien a nuestros paisanos, es su derecho, lo merecen, son para nosotros héroes, entonces lo mínimo es que tengan atención de primera, que los atiendan bien, muy bien, entonces vamos a ver esto.",seguridad,y bueno ir a seguir mejorar el servicio y limpiar de corrupción todo el gobierno y en este caso el consulado y él tener que atender mucho bien a nuestro paisano ser su derecho él merecer ser para yo héroe entonces él mínimo ser que tener atención de primero que él atender bien mucho bien entonces ir a ver este
315," Muy bien, mira, en lo primero la recomendación es que no se utilice dinero del presupuesto para favorecer a ningún partido, a ningún candidato, que se actúe con transparencia, que el voto sea libre, que las elecciones sean libres y limpias, que se acabe el fraude electoral, que no haya compras de votos, que no se condicione el voto para la entrega de Programas de Bienestar, que no se repartan despensas, todo eso que… La vergüenza.",economia,  mucho bien mirar en él primero el recomendación ser que no él utilizar dinero del presupuesto para favorecer a ninguno partido a ninguno candidato que él actuar con transparencia que el voto ser libre que el elección ser libre y limpio que él acabar el fraude electoral que no haber compra de voto que no él condicionar el voto para el entrega de programa de bienestar que no él repartir despensa todo ese que el vergüenza
316,"En la elección intermedia federal suscribimos una carta todos los gobernadores y el presidente para que se dejara en libertad a los ciudadanos. Se tiene ese documento y vamos a volver a reproducirlo por estas elecciones que están en puerta, la elección en Coahuila y la elección en el Estado de México.",opinion,en el elección intermedia federal suscribir uno carta todo el gobernador y el presidente para que él dejar en libertad a el ciudadano él tener ese documento y ir a volver a reproducir él por este elección que estar en puerta el elección en coahuila y el elección en el estado de méxico
317,"Entonces, también decirles a los ciudadanos que denuncien, que no se dejen y no permitir el fraude electoral. Y hay instancias, está la fiscalía electoral para presentar denuncias, el mismo INE, hay que acudir a las autoridades y presentar denuncias, pruebas, de que se está utilizando dinero de procedencia ilícita.",economia,entonces también decir él a el ciudadano que denunciar que no él dejar y no permitir el fraude electoral y haber instancia estar el fiscalía electoral para presentar denuncia el mismo ine haber que acudir a el autoridad y presentar denuncia prueba de que él estar utilizar dinero de procedencia ilícito
318,"Pero la recomendación es que los ciudadanos ayuden para que se pueda establecer en nuestro país una auténtica, una verdadera democracia, que no se trafique con la pobreza de la gente, que no bombardeen con publicidad a los ciudadanos, porque eso ha costado muchísimo, no sólo dinero, sino eso ha causado el estancamiento económico del país, porque antes se elegían así a las autoridades, con mucha publicidad, era como meter al mercado un producto, aunque fuese chatarra, como vender detergente o cualquier mercancía.",economia,pero el recomendación ser que el ciudadano ayudar para que él poder establecer en nuestro país uno auténtico uno verdadero democracia que no él traficar con el pobreza de el gente que no bombardear con publicidad a el ciudadano porque ese haber costar muchísimo no sólo dinero sino ese haber causar el estancamiento económico del país porque antes él elegir así a el autoridad con mucho publicidad ser como meter al mercado uno producto aunque ser chatarra como vender detergente o cualquiera mercancía
319,"Entonces, cuidar todo eso, que no haya uso indebido del presupuesto público, que no se compren los votos, pero depende mucho, mucho, mucho de los ciudadanos, de la denuncia. Yo en la campaña llegaba a decir si les llegan a ofrecer, que les van a dar despensas, entregaban tinacos y pollos y patos, chivos, borregos, puercos, cochinos, marranos, cerdos, así decía. Y si están muy, muy necesitados pues, bueno, dinero del presupuesto. No se debe de hacer, pero está permitido decir una mentira piadosa, díganles que sí, pero a la hora de la hora el voto es libre, es secreto.",competencia,entonces cuidar todo ese que no haber uso indebido del presupuesto público que no él comprar el voto pero depender mucho mucho mucho de el ciudadano de el denuncia yo en el campaña llegar a decir si él llegar a ofrecer que él ir a dar despensa entregar tinaco y pollo y pato chivo borrego puerco cochino marrano cerdo así decir y si estar mucho mucho necesitado pues bueno dinero del presupuesto no él deber de hacer pero estar permitido decir uno mentira piadós díganles que sí pero a el hora de el hora el voto ser libre ser secreto
320,"Pues votar como les dicte su consciencia y a estos mañosos hacerles: ‘Toma tu voto, toma tu Champotón’.",competencia,pues votar como él dictar su consciencia y a este mañoso hacer él toma tu voto tomar tu champotón
321,"Pero hay que denunciar todo esto porque existe aún la mala costumbre de la compra del voto, entonces hay que combatir eso.",competencia,pero haber que denunciar todo este porque existir aún el malo costumbre de el compra del voto entonces haber que combatir ese
322,"Acerca de lo que planteas de la aduana, con Jesús déjanos la información y vemos a pedir al secretario de Marina que haga la investigación y que nos informe.",seguridad,acerca de él que plantear de el aduana con jesús déjano el información y ver a pedir al secretario de marina que hacer el investigación y que yo informir
323," Bueno, en los dos casos ayudamos. Para los trabajadores de limpia, buscamos que los reciban en el gobierno de la ciudad, ahora nos das la información, vamos a pedírselo a la jefa de Gobierno, Claudia Sheinbaum.",opinion,  bueno en el dos caso ayudar para el trabajador de limpia buscar que él recibir en el gobierno de el ciudad ahora yo dar el información ir a pedir él él a el jefa de gobierno claudia sheinbaum
324,"Y en el otro caso al doctor Pedro Zenteno, del Issste, para que también los atiendan, si te parece.",opinion,y en el otro caso al doctor pedro zenteno del issste para que también él atender si tú parecer
325," No sabemos todavía cómo están los acontecimientos en Sinaloa. Hay un operativo que inició en la madrugada y más tarde vamos a informarles sobre eso, eso más tarde se informa para que se tenga la información precisa, no nos adelantemos. Va a informar seguramente la secretaria de Seguridad Pública aquí, aquí, como a las 11, 12 de la mañana del día de hoy.",seguridad,  no saber todavía cómo estar el acontecimiento en sinaloa haber uno operativo que iniciar en el madrugada y más tarde ir a informar él sobre ese ese más tarde él informar para que él tener el información preciso no yo adelantar ir a informar seguramente el secretaria de seguridad público aquí aquí como a el 11 12 de el mañana del día de hoy
326,"Tú haces una denuncia sobre esto; hoy mismo el director del Seguro va a informar. Si hay elementos, se actúa, se cancelan los contratos. No hay impunidad y mucho menos corrupción.",seguridad,tú hacer uno denuncia sobre este hoy mismo el director del seguro ir a informar si haber elemento él actuar él cancelar el contrato no haber impunidad y mucho menos corrupción
327," Sí, pero no pueden, no pueden, porque depende mucho de la dirección. Siempre lo he dicho, si el de arriba es corrupto, todos los demás van a ser corruptos. A lo mejor van a haber excepciones, pero la regla es que la corrupción se da fundamentalmente de arriba para abajo.",seguridad,  él pero no poder no poder porque depender mucho de el dirección siempre él haber decir si el de arriba ser corrupto todo el demá ir a ser corrupto a él mejor ir a haber excepción pero el regla ser que el corrupción él dar fundamentalmente de arriba para abajo
328,Imagínense la corrupción que significa que una gran empresa no pague en un año 15 mil millones de pesos de impuestos. ¿Cuántas mordidas son? Nada más un atraco.,economia,imagínense el corrupción que significar que uno gran empresa no pagar en uno año 15 mil millón de pesos de impuesto cuántos mordida ser nada más uno atraco
329,"Entonces, no se permite la corrupción; entonces, si no hay corrupción arriba, no tiene por qué haber corrupción abajo. Claro, hay resistencias y no es fácil, porque estamos hablando de siglos de corrupción, desde que llegaron los españoles. Hay constancia, porque no podemos saber a ciencia cierta cómo era la sociedad prehispánica, hay códices, aquí Diego nos puede ilustrar, hay transmisión oral de experiencias, pero documentos, pruebas testimoniales, a partir de que llegan los conquistadores españoles.",seguridad,entonces no él permitir el corrupción entonces si no haber corrupción arriba no tener por qué haber corrupción abajo claro haber resistencia y no ser fácil porque estar hablar de siglo de corrupción desde que llegar el español haber constancia porque no poder saber a ciencia cierto cómo ser el sociedad prehispánico haber códiz aquí diego yo poder ilustrar haber transmisión oral de experiencia pero documento prueba testimonial a partir de que llegar el conquistador español
330," Se lo vamos a pedir a María Luisa Albores y, si es necesario, como tú lo propones, que se coordinen con Conagua, con Germán Martínez, con el ingeniero Germán Martínez, de Conagua, y que nos entreguen aquí un informe.",apoyo,  él él ir a pedir a maría luisa albores y si ser necesario como tú él proponer que él coordinar con conagua con germán martínez con el ingeniero germán martínez de conagua y que yo entregar aquí uno informe
331," Sí, pero no te voy a contestar yo ahora. Yo te exhorto, te pido de manera respetuosa que nos dejes nada más ver cómo está, porque se van a construir 55 universidades más, hay 145 ya funcionando y se van a construir 55 más.",apoyo,  él pero no tú ir a contestar yo ahora yo tú exhortar tú pedir de manera respetuoso que yo dejes nada más ver cómo estar porque él ir a construir 55 universidad más haber 145 ya funcionar y él ir a construir 55 más
332," Sí, si no hay otras escuelas públicas, si hay la población suficiente que está terminando la educación media superior. O sea, no es como antes pues que:",apoyo,  sí si no haber otro escuela público si haber el población suficiente que estar terminar el educación medio superior o sea no ser como antes pues que
333,"Bueno, pues vamos a informar primero sobre lo sucedido ayer en Sinaloa. Ya se informó al mediodía de ayer, lo hizo el Gabinete de Seguridad, hoy también, y vamos a estar informando constantemente; sobre todo, para tranquilidad de la población en general y en especial a la población de Sinaloa, que les enviamos nuestra solidaridad, nuestro apoyo, para que puedan recuperar lo más pronto posible la normalidad, se está haciendo todo con ese propósito. Y lo que se va a informar tiene que ver con la manera responsable en que se actuó para cuidar a la población civil, que no hubieran víctimas inocentes, eso vamos a tratarlo.",seguridad,bueno pues ir a informar primero sobre él sucedido ayer en sinaloa ya él informar al mediodía de ayer él hacer el gabinete de seguridad hoy también y ir a estar informar constantemente sobre todo para tranquilidad de el población en general y en especial a el población de sinaloa que él enviar nuestro solidaridad nuestro apoyo para que poder recuperar él más pronto posible el normalidad él estar hacer todo con ese propósito y él que él ir a informar tener que ver con el manera responsable en que él actuar para cuidar a el población civil que no haber víctima inocente ese ir a tratar él
334,"Afortunadamente también se contó con el apoyo del gobierno del estado, del gobernador Rubén Rocha, de autoridades municipales, y todo esto permitió que las cosas no fuesen más difíciles, dramáticas, aun cuando, pues hubo enfrentamientos entre la delincuencia, entre las autoridades con las corporaciones del Ejército, de la Guardia Nacional, de la guardia civil, y con los grupos de la delincuencia.",seguridad,afortunadamente también él contar con el apoyo del gobierno del estado del gobernador rubén rocha de autoridad municipal y todo este permitir que el cosa no ser más difícil dramático aun cuando pues haber enfrentamiento entre el delincuencia entre el autoridad con el corporación del ejército de el guardia nacional de el guardia civil y con el grupo de el delincuencia
335,"Lamentamos mucho la pérdida de vidas, desde luego, de quienes perdieron la vida en el cumplimiento de su deber: soldados y miembros de la Guardia; y también lamentamos todas las pérdidas de vida de los seres humanos que el día de ayer participaron en estos enfrentamientos.",seguridad,lamentar mucho el pérdida de vida desde luego de quien perder el vida en el cumplimiento de su deber soldado y miembro de el guardia y también lamentar todo el pérdida de vida de el ser humano que el día de ayer participar en este enfrentamiento
336,"Entonces, vamos a que nos informe la secretaria de Seguridad y Protección Ciudadana, Rosa Icela Rodríguez, y el general Luis Cresencio Sandoval González, secretario de la Defensa.",seguridad,entonces ir a que yo informir el secretaria de seguridad y protección ciudadano rosa icela rodríguez y el general luis cresencio sandoval gonzález secretario de el defensa
337,"Terminando este informe, el secretario de Relaciones Exteriores, Marcelo Ebrard, va a informar sobre la visita del presidente Biden, del primer ministro Trudeau, la cumbre América del Norte, porque mañana es sábado, no hay conferencia, ni el domingo, es hasta el lunes que nos vamos a volver a encontrar. Aun cuando ya va a estar aquí el presidente Biden, en nuestro país, que es bienvenido, como el primer ministro Trudeau, el lunes sí vamos a tener conferencia en la mañana, martes y miércoles no, también para que vayan ustedes preparándose, que sepan cómo es.",exterior,terminar este informe el secretario de relaciones exteriores marcelo ebrard ir a informar sobre el visita del presidente biden del primero ministro trudeau el cumbre américo del norte porque mañana ser sábado no haber conferencia ni el domingo ser hasta el lunes que yo ir a volver a encontrar aun cuando ya ir a estar aquí el presidente biden en nuestro país que ser bienvenir como el primero ministro trudeau el lunes sí ir a tener conferencia en el mañana martes y miércoles no también para que ir tú preparar él que saber cómo ser
338,"Yo hoy tengo una gira de fin de semana, voy a la supervisión del Tren Maya. Ya es una gira que estoy haciendo cada 15 días para que no dejemos de avanzar en esa gran obra de tanta importancia para el sureste y que va a ayudar mucho al desarrollo de cinco estados del país.",economia,yo hoy tener uno gira de fin de semana ir a el supervisión del tren maya ya ser uno gira que estar hacer cada 15 día para que no dejar de avanzar en ese gran obra de tanto importancia para el sureste y que ir a ayudar mucho al desarrollo de cinco estado del país
339,"Entonces, tengo que estar allá porque es una obra magna, una obra muy grande, son mil 554 kilómetros y tenemos que terminar a finales de este año. Entonces, por eso empecé con giras de supervisión cada mes, el año pasado cada tres semanas y este año cada 15 días, tramo por tramo, para terminar con esta obra.",economia,entonces tener que estar allá porque ser uno obra magno uno obra mucho grande ser mil 554 kilómetro y tener que terminar a finales de este año entonces por ese empezar con gira de supervisión cada mes el año pasado cada tres semana y este año cada 15 día tramo por tramo para terminar con este obra
340," Bueno, primero decir que se va a mantener la presencia de elementos de la Secretaría de la Defensa, de la Guardia Nacional, de la policía estatal, que está colaborando, y que se va a tener esta protección para que no haya daños a la población civil en todo Sinaloa, esa es la decisión que se ha tomado.",seguridad,  bueno primero decir que él ir a mantener el presencia de elemento de el secretaría de el defensa de el guardia nacional de el policía estatal que estar colaborar y que él ir a tener este protección para que no haber daño a el población civil en todo sinaloa ese ser el decisión que él haber tomar
341,"Afortunadamente hay una calma en estos tiempos, en estas últimas horas. Hablé con el gobernador y él me menciona que no hay grupos armados en Sinaloa, bloqueos, que ya están quitando desde ayer todos los carros que fueron incendiados y que utilizaron para bloquear las calles, prácticamente en toda la ciudad. Lo que me dijo hoy en la mañana:",seguridad,afortunadamente haber uno calma en este tiempo en este último hora hablé con el gobernador y él yo mencionar que no haber grupo armado en sinaloa bloqueo que ya estar quitar desde ayer todo el carro que ser incendiar y que utilizar para bloquear el calle prácticamente en todo el ciudad él que yo decir hoy en el mañana
342,"‘Señor presidente, como le dije por teléfono, no existen bloqueos activos, sólo la interrupción de la circulación en algunos tramos carreteros donde aún no hemos alcanzado a retirar por completo los vehículos bloqueadores, por ser muy grandes y porque están muy complejos debido a la situación en que los colocaron, pero estamos trabajando para retirar chatarra y escombros en todas las vías. Quizá esa tarea nos lleve todo el día, sobre todo en ciertos tramos carreteros.",seguridad,señor presidente como él decir por teléfono no existir bloqueo activo sólo el interrupción de el circulación en alguno tramo carretero donde aún no haber alcanzar a retirar por completo el vehículo bloqueador por ser mucho grande y porque estar mucho complejo debido a el situación en que él colocar pero estar trabajar para retirar chatarra y escombro en todo el vía quizá ese tarea yo llevar todo el día sobre todo en cierto tramo carretero
343,"‘En la ciudad de Culiacán ya abrimos todas las calles bloqueadas y estamos en la tarea de retirar los carros quemados, que los orillamos a las banquetas. No hay bloqueos bajo resistencia de gente armada. La tardanza sólo es por lo difícil, arduo de las labores que le comento.’",seguridad,en el ciudad de culiacán ya abrir todo el calle bloqueado y estar en el tarea de retirar el carro quemado que el orillamo a el banqueta no haber bloqueo bajo resistencia de gente armado el tardanza sólo ser por él difícil arduo de el labor que él comentar
344,"Esto es el informe del gobernador. Entonces, esperemos que se siga con esta labor y al mismo tiempo la vigilancia.",seguridad,este ser el informe del gobernador entonces esperar que él seguir con este labor y al mismo tiempo el vigilancia
345,"Acerca de las interpretaciones, pues hay muchas, las repensamos, desde luego no las compartimos, porque nosotros actuamos con autonomía. Yo les voy a poner como antecedente que, en dos momentos difíciles, siendo presidente Donald Trump me habló para ofrecernos apoyo, precisamente cuando se detuvo y se tuvo que soltar la primera vez a Ovidio. En esa ocasión yo tomé la decisión de dejarlo en libertad por los riesgos a la población civil, calculamos que iban a haber muchos muertos inocentes y tomamos esa decisión. Me habló el presiente Trump para ofrecerme apoyo; se lo agradecí y le dije que era un asunto nuestro y que nosotros íbamos a enfrentarlo, a resolverlo.",exterior,acerca de el interpretación pues haber mucho el repensamo desde luego no él compartir porque yo actuar con autonomía yo él ir a poner como antecedente que en dos momento difícil ser presidente donald trump yo hablar para ofrecer yo apoyo precisamente cuando él detener y él tener que soltar el primero vez a ovidio en ese ocasión yo tomar el decisión de dejar él en libertad por el riesgo a el población civil calcular que ir a haber mucho muerto inocente y tomar ese decisión yo hablar el presiente trump para ofrecerme apoyo él él agradecer y él decir que ser uno asunto nuestro y que yo ír a enfrentar él a resolver él
346,"Luego vino otro hecho, también muy lamentable: el asesinato de mujeres en Bavispe, con niños, la familia LeBarón y dos familias más. Entonces, pues fue también muy fuerte ese hecho lamentable, y me habló también el presiente Trump para lo mismo, para decirme que ellos podían ayudar con personal y con lo que se necesitara; y lo mismo, la respuesta fue: No, muchas gracias, nosotros vamos a investigar lo que sucedió, como corresponde, y se va a castigar a los responsables. Cosa que, por cierto, ya se hizo, porque hay cerca de 100 detenidos en el caso de Bavispe.",exterior,luego venir otro hecho también mucho lamentable el asesinato de mujer en bavispe con niño el familia lebarón y dos familia más entonces pues ser también mucho fuerte ese hecho lamentable y yo hablar también el presiente trump para él mismo para decirme que él poder ayudar con personal y con él que él necesitar y él mismo el respuesta ser no mucho gracia yo ir a investigar él que suceder como corresponder y él ir a castigar a el responsable cosa que por cierto ya él hacer porque haber cerca de 100 detenido en el caso de bavispe
347,"Entonces, actuamos con autonomía, con independencia. Sí hay cooperación, y la va a seguir habiendo, pero las decisiones las tomamos como gobierno soberano, independiente, y estas decisiones pues las tomamos en el Gabinete de Seguridad.",seguridad,entonces actuar con autonomía con independencia sí haber cooperación y él ir a seguir haber pero el decisión él tomar como gobierno soberano independiente y este decisión pues él tomar en el gabinete de seguridad
