,Texto,Clasificacion,clean
0,"También vamos a informar este primer día hábil del año 2023 sobre la dispersión de los fondos para los adultos mayores, que va a iniciar esta semana. Y queremos informar porque ya son muchos y cuando no hay información, están inquietos, esperando que lleguen sus pensiones que por derecho la corresponden.",apoyo,también ir a informar este primero día hábil del año 2023 sobre el dispersión de el fondo para el adulto mayor que ir a iniciar este semana y querer informar porque ya ser mucho y cuando no haber información estar inquieto esperar que llegar su pensión que por derecho él corresponder
1,"Y ahora se va a informar porque se está optando por un calendario de acuerdo a las letras del primer apellido, la primera letra del primer apellido, para que vayan al banco cuando les toque. Y esto va a ayudar mucho, porque ya estamos hablando de millones de adultos mayores, y hay además otros beneficiarios que también tienen que llegar a los bancos.",apoyo,y ahora él ir a informar porque él estar optar por uno calendario de acuerdo a el letra del primero apellido el primero letra del primero apellido para que ir al banco cuando él tocar y este ir a ayudar mucho porque ya estar hablar de millón de adulto mayor y haber además otro beneficiario que también tener que llegar a el banco
2,"En esta etapa se combinan los bancos particulares, comerciales, con el Banco del Bienestar, pero hacia adelante ya va a ser sólo el Banco del Bienestar. También sobre cómo se va a llevar a cabo esta transición se va a ir informando. Y es un proceso, no es de un día para otro.",apoyo,en este etapa él combinar el banco particular comercial con el banco del bienestar pero hacia adelante ya ir a ser sólo el banco del bienestar también sobre cómo él ir a llevar a cabo este transición él ir a ir informar y ser uno proceso no ser de uno día para otro
3,"También Ariadna Montiel, que es la secretaria de Bienestar, va a informarnos hoy sobre cuándo empiezan los pagos, que todavía se tienen que hacer en efectivo porque son comunidades muy apartadas, en donde estamos en proceso de construcción y de operación de Bancos del Bienestar. Pero todavía, de los cerca de tres mil sucursales, tenemos ya como dos mil 300, dos 500 terminadas, vamos por 500, este primer semestre vamos a terminar.",apoyo,también ariadna montiel que ser el secretaria de bienestar ir a informar yo hoy sobre cuándo empezar el pago que todavía él tener que hacer en efectivo porque ser comunidad mucho apartado en donde estar en proceso de construcción y de operación de banco del bienestar pero todavía de el cerca de tres mil sucursal tener ya como dos mil 300 dos 500 terminado ir por 500 este primero semestre ir a terminar
4,"Pero tenerlas terminadas no significa tenerlas operando, porque se requiere tener cajeros, se requiere comunicación, se requiere, pues, que funcionen. Entonces, nos va a llevar toda la primera mitad de este año que ya estén las tres mil sucursales del Banco del Bienestar, entonces sí ya no se va a pagar en efectivo y va a estar muy cerca la sucursal del banco de la gente.",apoyo,pero tener él terminado no significar tener él operar porque él requerir tener cajero él requerir comunicación él requerir pues que funcionar entonces yo ir a llevar todo el primero mitad de este año que ya estar el tres mil sucursal del banco del bienestar entonces sí ya no él ir a pagar en efectivo y ir a estar mucho cerca el sucursal del banco de el gente
5,"También lo ocurrido ayer en Chihuahua, en Ciudad Juárez. Les adelanto, va a haber una conferencia de prensa a las 11:00 por parte del Gabinete de Seguridad aquí mismo para informarles sobre todo lo sucedido. Se está también esperando que informe más el gobierno del estado de Chihuahua, que ya lo está haciendo, pero para informar por completo a las 11:00 de la mañana, aquí mismo va a estar el Gabinete de Seguridad.",seguridad,también él ocurrido ayer en chihuahua en ciudad juárez él adelantar ir a haber uno conferencia de prensa a el 1100 por parte del gabinete de seguridad aquí mismo para informar él sobre todo él sucedido él estar también esperar que informir más el gobierno del estado de chihuahua que ya él estar hacer pero para informar por completo a el 1100 de el mañana aquí mismo ir a estar el gabinete de seguridad
6," Bueno, ahora que estuvo con nosotros el gobernador Alfredo del Mazo se habló del tema, él informó, están conscientes de que hace falta más actividad, más acciones, en lo que tiene que ver con el feminicidio y dio a conocer el que ya están aplicándose en esta necesidad de garantizar la paz, la tranquilidad, el que no se agredan a las mujeres, que no haya feminicidios.",seguridad,  bueno ahora que estar con yo el gobernador alfredo del mazo él hablar del tema él informar estar consciente de que hacer falta más actividad más acción en él que tener que ver con el feminicidio y dar a conocer el que ya estar aplicar él en este necesidad de garantizar el paz el tranquilidad el que no él agredir a el mujer que no haber feminicidio
7,"Y vamos a estar nosotros pendientes. Mañana vamos a informar sobre seguridad a nivel del país, pero va a estar la secretaria de Seguridad Pública, Rosa Icela Rodríguez, y ella puede ampliar la información sobre lo que está sucediendo en el Estado de México.",seguridad,y ir a estar yo pendiente mañana ir a informar sobre seguridad a nivel del país pero ir a estar el secretaria de seguridad público rosa icela rodríguez y él poder ampliar el información sobre él que estar suceder en el estado de méxico
8,"Quiero decir que tenemos muy buena relación con el gobierno del Estado de México, que consideramos que está funcionando bien la fiscalía del Estado de México, y un ejemplo reciente es que se revisó el caso de una persona que atropelló a un peatón, un trabajador de la calle, alguien que se buscaba la vida vendiendo tamales y que se le había dado la libertad. Y se planteó aquí, y le agradecemos mucho al gobierno del Estado de México, a la fiscalía, que retomaron el caso y se volvió a detener a esta persona. Porque fue muy comentado, hablándose de influyentismo, y ya hemos llegado a la conclusión, y así lo demuestran los hechos, que no se permite el influyentismo ni en el gobierno federal y en este caso en gobiernos estatales, como quedó demostrado en el caso del gobierno del Estado de México. Por eso mi reconocimiento a lo que hicieron.",opinion,querer decir que tener mucho buen relación con el gobierno del estado de méxico que considerar que estar funcionar bien el fiscalía del estado de méxico y uno ejemplo reciente ser que él revisar el caso de uno persona que atropellar a uno peatón uno trabajador de el calle alguien que él buscar el vida vender tamal y que él él haber dar el libertad y él plantear aquí y él agradecer mucho al gobierno del estado de méxico a el fiscalía que retomar el caso y él volver a detener a este persona porque ser mucho comentado hablar él de influyentismo y ya haber llegar a el conclusión y así él demostrar el hecho que no él permitir el influyentismo ni en el gobierno federal y en este caso en gobierno estatal como quedar demostrado en el caso del gobierno del estado de méxico por ese mi reconocimiento a él que hacer
9," No, pero si podemos ayudar orientando a los pensionados, nos ponemos de acuerdo, que vengan aquí y nosotros les ayudamos en la gestión. Si es algo que tenga que ver con lo federal, tiene que atenderse, tiene que haber justicia; si es un asunto del estado, hacemos la gestión, el trámite. Y repito, tenemos muy buena relación con el gobierno del Estado de México.",opinion,  no pero si poder ayudar orientar a el pensionado yo poner de acuerdo que vengar aquí y yo él ayudar en el gestión si ser algo que tener que ver con él federal tener que atender él tener que haber justicia si ser uno asunto del estado hacer el gestión el trámite y repetir tener mucho buen relación con el gobierno del estado de méxico
10,"Primero, en la fortaleza cultural de nuestro pueblo, de ahí viene todo, de ahí dimana nuestra fortaleza para resistir cualquier calamidad, llámese pandemia, crisis económica, malos gobiernos, huracanes, temblores.",opinion,primero en el fortaleza cultural de nuestro pueblo de ahí venir todo de ahí dimán nuestro fortaleza para resistir cualquiera calamidad llámese pandemio crisis económico malo gobierno huracán temblor
11,"No hemos valorado lo suficiente la importancia que tiene el haber heredado virtudes de las sociedades prehispánicas, yo creo que hay que replantearnos eso. Porque nos hemos limitado a estudiar la historia de México y sus culturas a partir de la llegada de los europeos, a partir de la invasión de España, que son 500 años, pero este país tiene culturas y civilizaciones milenarias.",opinion,no haber valorar él suficiente el importancia que tener el haber heredar virtud de el sociedad prehispánica yo creer que haber que replantear yo ese porque yo haber limitar a estudiar el historia de méxico y su cultura a partir de el llegada de el europeo a partir de el invasión de españa que ser 500 año pero este país tener cultura y civilización milenaria
12,"México no se fundó con la llegada de los españoles hace 500 años; es más, ni siquiera se fundó a partir de la llegada de los mexicas a lo que hoy es la Ciudad de México, antes Tenochtitlan, porque eso se da 200 años antes de la llegada de los europeos, 1322, 1323, de acuerdo a las investigaciones arqueológicas, históricas.",opinion,méxico no él fundar con el llegada de el español hacer 500 año ser más ni siquiera él fundar a partir de el llegada de el mexicas a él que hoy ser el ciudad de méxico antes tenochtitlan porque ese él dar 200 año antes de el llegada de el europeo 1322 1323 de acuerdo a el investigación arqueológico histórico
13,"Pero estuve ahora en Palenque y resulta que ese sitio arqueológico se construye mil años antes de que llegaran los españoles. Y ahí está el arte, ahí está el conocimiento de la astronomía, de las matemáticas, de la arquitectura, de la ciencia. Y más atrás la cultura madre, la cultura olmeca, 900 años antes de Cristo. Entonces, imagínense lo que heredamos, históricamente eso es lo que nos ha salvado siempre.",opinion,pero estar ahora en palenque y resultar que ese sitio arqueológico él construir mil año antes de que llegar el español y ahí estar el arte ahí estar el conocimiento de el astronomía de el matemática de el arquitectura de el ciencia y más atrás el cultura madre el cultura olmeco 900 año antes de cristo entonces imagínense él que heredar históricamente ese ser él que yo haber salvar siempre
14,"Y lo otro es nuestro proceso histórico, que es de los más importantes y fecundos en el mundo, por eso los neoliberales querían que ya no se hablara de historia, cuando impusieron su modelo neoliberal hablaron del fin de la historia.",opinion,y él otro ser nuestro proceso histórico que ser de el más importante y fecundo en el mundo por ese el neoliberal querer que ya no él hablar de historia cuando imponer su modelo neoliberal hablar del fin de el historia
15,"Pues, cómo a un conservador le va a gustar que se recuerde a Hidalgo, si planteó la abolición de la esclavitud y los realistas de ese entonces se oponían, toda la llamada clase gobernante. Y lo asesinan, y le cortan la cabeza y la exhiben como escarmiento 10 años en la plaza de Guanajuato. Imagínense el odio de tener la cabeza del padre de nuestra patria, del cura Hidalgo, 10 años. Cómo van a querer que se hable de eso.",opinion,pues cómo a uno conservador él ir a gustar que él recordar a hidalgo si plantear el abolición de el esclavitud y el realista de ese entonces él oponer todo el llamado clase gobernante y él asesinar y él cortar el cabeza y él exhibir como escarmiento 10 año en el plaza de guanajuato imagínense el odio de tener el cabeza del padre de nuestro patria del cura hidalgo 10 año cómo ir a querer que él hablar de ese
16,"Yo estoy seguro que la mayoría de los mexicanos no lo sabía, de que habían asesinado al padre Hidalgo, que le cortaron la cabeza y luego la exhibieron 10 años. Al contrario, lo que hicieron durante el periodo neoliberal hasta financiaban películas para distorsionar la historia y proyectar una imagen de Hidalgo distinta y lo mismo hicieron con Morelos.",opinion,yo estar seguro que el mayoría de el mexicano no él saber de que haber asesinar al padre hidalgo que él cortar el cabeza y luego él exhibir 10 año al contrario él que hacer durante el periodo neoliberal hasta financiar película para distorsionar el historia y proyectar uno imagen de hidalgo distinto y él mismo hacer con morelo
17,"Todavía recuerdo, creo que fue en los 80 que un buen actor, presentaron una obra de Morelos, El martirio de Morelos, una obra de teatro, pero ya no volví a ver nada de Morelos. Y Juárez.",opinion,todavía recordar creer que ser en el 80 que uno buen actor presentar uno obra de morelo el martirio de morelo uno obra de teatro pero ya no volver a ver nada de morelo y juárez
18,¿Pero dónde están los Hidalgos en el mundo? ¿Dónde están los Morelos? ¿Dónde están los Juárez? ¿Dónde están los Maderos? ¿Dónde están los Villas? ¿Dónde están los Zapatas? ¿Dónde está el general Cárdenas? ¿Cuáles son los gobiernos como los del general Cárdenas en el mundo?,opinion,pero dónde estar el hidalgo en el mundo dónde estar el morelo dónde estar el juárez dónde estar el madero dónde estar el villa dónde estar el zapata dónde estar el general cárdenas cuál ser el gobierno como el del general cárdenas en el mundo
19,"Porque tenemos todo ese bagaje, todo ese legado que nos guía. Y por eso tenemos un pueblo excepcional, un pueblo bueno, un pueblo fraterno, solidario, trabajador.",opinion,porque tener todo ese bagaje todo ese legado que yo guiar y por ese tener uno pueblo excepcional uno pueblo bueno uno pueblo fraterno solidario trabajador
20,"No. Sí, en la mayoría de los pueblos del mundo hay humanismo, hay fraternidad, pero lo nuestro es algo excepcional, el humanismo mexicano.",opinion,no él en el mayoría de el pueblo del mundo haber humanismo haber fraternidad pero él nuestro ser algo excepcional el humanismo mexicano
21,"Entonces, por eso creo que vamos a salir adelante, que se va a consolidar nuestra economía este año, que vamos a seguir creciendo, que vamos a seguir manteniendo equilibrios macroeconómicos, que vamos a tener buena recaudación, que como no se permite la corrupción y no se permite el que haya lujos en el gobierno el presupuesto nos va a alcanzar, rinde.",economia,entonces por ese creer que ir a salir adelante que él ir a consolidar nuestro economía este año que ir a seguir crecer que ir a seguir mantener equilibrio macroeconómico que ir a tener buen recaudación que como no él permitir el corrupción y no él permitir el que haber lujo en el gobierno el presupuesto yo ir a alcanzar rendir
22,"Yo siempre les hablaba de que cuando llegamos al gobierno el presupuesto del 2018 en Presidencia de la República ascendió a tres mil 600 millones de pesos, ahí está en la cuenta pública, lo pueden constatar, y este año apenas vamos a llegar —o el año del 22, porque ya se cerró— a 500 millones, de tres mil 600 a 500. Ya podrían hasta hacerse las cuentas de gastos de viáticos de Presidencia con los otros poderes o con los organismos autónomos y se van a encontrar cosas muy importantes.",economia,yo siempre él hablar de que cuando llegar al gobierno el presupuesto del 2018 en presidencia de el república ascender a tres mil 600 millón de pesos ahí estar en el cuenta público él poder constatar y este año apenas ir a llegar o el año del 22 porque ya él cerrar a 500 millón de tres mil 600 a 500 ya poder hasta hacer él el cuenta de gasto de viático de presidencia con el otro poder o con el organismo autónomo y él ir a encontrar cosa mucho importante
23,"Entonces, en lo económico bien, en lo social mucho mejor. Aquí estamos viendo cómo estamos garantizando el compromiso de aumentar 25 por ciento la pensión a adultos mayores, y como nunca se está incrementando el presupuesto para el bienestar del pueblo, sobre todo de la gente humilde este año.",economia,entonces en él económico bien en él social mucho mejor aquí estar ver cómo estar garantizar el compromiso de aumentar 25 por ciento el pensión a adulto mayor y como nunca él estar incrementar el presupuesto para el bienestar del pueblo sobre todo de el gente humilde este año
24,"Entonces, todo eso son empleos, trabajo. Por eso hablo que en lo económico bien, en lo social bien, en lo político lo mismo. Porque si se atiende al pueblo, si no hay autoritarismo, si no hay corrupción, si no se violan los derechos humanos, pues no se tienen porque presentar problemas.",economia,entonces todo ese ser empleo trabajar por ese hablar que en él económico bien en él social bien en él político él mismo porque si él atender al pueblo si no haber autoritarismo si no haber corrupción si no él violar el derechos humanos pues no él tener porque presentar problema
25,"Claro, nuestros adversarios tienen otros propósitos para el 2023, como los tuvieron para el 2022, como los tuvieron para el 2021. Decían que —como no me cae bien el dictador y además ya falleció— decían los opositores a la dictadura de ese país y a ese dictador, que estaban aquí en México, se reunían y le hacían así en la mesa, ‘este año cae’, y se les fue enchuecando el dedo. Yo ya lo tengo chueco. Pero así están nuestros adversarios.",competencia,claro nuestro adversario tener otro propósito para el 2023 como él tener para el 2022 como él tener para el 2021 decir que como no yo caer bien el dictador y además ya fallecer decir el opositor a el dictadura de ese país y a ese dictador que estar aquí en méxico él reunir y él hacer así en el mesa este año caer y él él ser enchuecar el dedo yo ya él tener chueco pero así estar nuestro adversario
26,"Este año, ¿se acuerdan de Aguilar Camín, que les dio el consejo, la receta?: ‘Vamos a ganarles el Congreso y si les ganamos el Congreso los paramos y después de ganar el Congreso le vamos a ganar la revocación del mandato y se va a tener que ir a Palenque’. Así de enfático.",competencia,este año él acordar de aguilar camín que él dar el consejo el receta ir a ganar él el congreso y si él ganar el congreso él parar y después de ganar el congreso él ir a ganar el revocación del mandato y él ir a tener que ir a palenque así de enfático
27,"‘Y luego vienen las gubernaturas, les vamos a ganar la mayoría de las gubernaturas’. Se les enchuecó un poquito más el dedo.",competencia,y luego venir el gubernatura él ir a ganar el mayoría de el gubernatura él él enchuecó uno poquito más el dedo
28,"Pero, ¿quieren conocer cuál es su pronóstico —que a mí me ayuda, para saber a ver qué están pensando— de los conservadores corruptos?",competencia,pero querer conocer cuál ser su pronóstico que a yo yo ayudar para saber a ver qué estar pensar de el conservador corrupto
29,"Ayer estaba yo viendo, a ver si lo consiguen, un mensaje de Claudio X. González, y ahí está su pronóstico en contra nuestra. Nada más para que la gente lo conozca porque, si no, se queda sólo en el círculo rojo. Y ahí sí, ahí sí le creen, lamentablemente.",competencia,ayer estar yo ver a ver si él conseguir uno mensaje de claudio x gonzález y ahí estar su pronóstico en contra nuestro nada más para que el gente él conocer porque si no él quedar sólo en el círculo rojo y ahí sí ahí sí él creer lamentablemente
30,"Ayer venía yo en el avión de regreso y un señor se paró con su teléfono y dice: ‘Tengo unas cosas que decirle. ¿No se enoja?’ No, no, no, para nada, para nada, para nada. Dice: ‘Lo hago con respeto’. Sí, cómo no, le escucho.",competencia,ayer venir yo en el avión de regreso y uno señor él parar con su teléfono y decir tener uno cosa que decir él no él enojar no no no para nada para nada para nada decir él hacer con respeto sí cómo no él escuchar
31,Y entonces: ‘¿Por qué está destruyendo el país? ¿Usted sabe que es uno de los gobiernos más corruptos que ha habido en México? ¿Por qué quería o quiere destruir el INE? ¿Por qué las empresas están cerrando y no tienen empleo los trabajadores?’,competencia,y entonces por qué estar destruir el país usted saber que ser uno de el gobierno más corrupto que haber haber en méxico por qué querer o querer destruir el ine por qué el empresa estar cerrar y no tener empleo el trabajador
32,"Y me dice: ‘Se lo digo con respeto’. ¿Qué me puede usted decir? ¿Qué me contesta?, porque tengo otras cosas’. Le digo: No, ya con eso tengo. Le digo: Mira, lo que te puedo decir es que entre nosotros no nos vamos a poder entender porque somos distintos, y yo te respeto. Y qué bien que me planteas esto, también con respeto, pero no nos vamos a poder entender.",competencia,y yo decir él él decir con respeto qué yo poder usted decir qué yo contestar porque tener otro cosa él decir no ya con ese tener él decir mirar él que tú poder decir ser que entre yo no yo ir a poder entender porque ser distinto y yo tú respetar y qué bien que yo plantear este también con respeto pero no yo ir a poder entender
33,"Me hablaste del bien común, le digo. Busca el origen del término, cómo se aplica en México. Y para qué te respondo, mejor sigue tu camino, ya no es posible que tu cambies ni yo voy a cambiar mi manera de pensar. Y lo único que me faltó fue decirle: Si tienes hijos, pues sí les daría yo tiempo para explicarle cosas a tus hijos.",competencia,yo hablar del bien común él decir buscar el origen del término cómo él aplicar en méxico y para qué tú responder mejor seguir tu camino ya no ser posible que tu cambies ni yo ir a cambiar mi manera de pensar y él único que yo faltar ser decir él si tener hijo pues sí él dar yo tiempo para explicar él cosa a tu hijo
34,"Y sí le dije a la gente humilde, a la gente que le cuesta más trabajo obtener información, les dedico mucho tiempo, pero ya en tu caso para qué pierdo el tiempo, mejor vamos a respetarnos, no nos vamos a entender, son dos pensamientos completamente distintos.",competencia,y sí él decir a el gente humilde a el gente que él costar más trabajo obtener información él dedicar mucho tiempo pero ya en tu caso para qué perder el tiempo mejor ir a respetar yo no yo ir a entender ser dos pensamiento completamente distinto
35,"Que como si hubiesen dado cuenta los del avión, cuando ya aterrizamos, un aplauso. Claro, venía yo de mi estado, no fue una encuesta tan objetiva, estaba un poco, no cuchareada, sino jicareada.",opinion,que como si haber dar cuenta el del avión cuando ya aterrizamos uno aplauso claro venir yo de mi estado no ser uno encuesta tanto objetivo estar uno poco no cuchareado sino jicareado
36,"‘Los estragos del más gobierno de Morena se hacen más evidentes’. Eso es lo que él apuesta, a que los estragos, todo el mal que ha hecho el gobierno se haga más evidente. Pues esto va a servir porque ya está anunciando que va a arreciar la guerra sucia, ¿no?",competencia,el estrago del más gobierno de morena él hacer más evidente ese ser él que él apostar a que el estrago todo el mal que haber hacer el gobierno él hacer más evidente pues este ir a servir porque ya estar anunciar que ir a arreciar el guerra sucio no
37,"‘Y las divisiones a su interior más marcadas’, o sea, apostando a que va a haber ruptura, también seguramente ya tienen un plan sobre eso.",competencia,y el división a su interior más marcado o ser apostar a que ir a haber ruptura también seguramente ya tener uno plan sobre ese
38,"‘La unión de Va por México ―o sea, la que él encabeza― se consolida ―eso es lo que él desea― con triunfos en el Estado de México y en Coahuila’. Así como decía Aguilar: ‘Vamos a ganarles la mayoría en el Congreso y luego les ganamos la revocación del mandato’.",competencia,el unión de ir por méxico o ser el que él encabezar él consolidar ese ser él que él desear con triunfo en el estado de méxico y en coahuila así como decir aguilar ir a ganar él el mayoría en el congreso y luego él ganar el revocación del mandato
39,"‘Tres, la sociedad marca pauta’ —la sociedad. A ver, politólogos, sociólogos, ¿qué es la sociedad?, ¿qué no es pueblo? Es la sociedad.",competencia,tres el sociedad marco pautar el sociedad a ver politólogo sociólogo qué ser el sociedad qué no ser pueblo ser el sociedad
